{
  "version": 2,
  "provider": "aws",
  "generated_at": "2026-05-01T00:00:00Z",
  "account": {
    "id": "123456789012",
    "alias": "example-sandbox"
  },
  "regions": [
    {
      "name": "us-east-1",
      "enabled": true
    }
  ],
  "capabilities": {
    "identity": true,
    "network": true,
    "security_groups": true,
    "iam": true,
    "s3": true,
    "rds": true,
    "kms": true,
    "secrets_manager": true,
    "eks": true
  },
  "edge": {
    "resources": {
      "aws_lambda_function_url.public_handler": {
        "terraform_address": "aws_lambda_function_url.public_handler",
        "account_id": "123456789012",
        "type": "aws_lambda_function_url",
        "region": "us-east-1",
        "public": true,
        "tags": {
          "env": "prod",
          "service": "public-api"
        }
      }
    }
  },
  "compute": {
    "resources": {
      "aws_lambda_function.public_handler": {
        "terraform_address": "aws_lambda_function.public_handler",
        "arn": "arn:aws:lambda:us-east-1:123456789012:function:example-public-handler",
        "account_id": "123456789012",
        "type": "aws_lambda_function",
        "region": "us-east-1",
        "tags": {
          "env": "prod",
          "service": "public-api"
        }
      }
    }
  },
  "data": {
    "resources": {
      "aws_secretsmanager_secret.customer": {
        "terraform_address": "aws_secretsmanager_secret.customer",
        "arn": "arn:aws:secretsmanager:us-east-1:123456789012:secret:customer",
        "account_id": "123456789012",
        "type": "aws_secretsmanager_secret",
        "region": "us-east-1",
        "sensitive_data": true,
        "sensitivity": {
          "data": true,
          "reason": "synthetic customer secret"
        },
        "tags": {
          "env": "prod",
          "data": "sensitive"
        }
      }
    }
  },
  "relationships": [
    {
      "from": "aws_lambda_function_url.public_handler",
      "to": "aws_lambda_function.public_handler",
      "type": "routes_to",
      "source": "lambda",
      "confidence": "high"
    },
    {
      "from": "aws_lambda_function.public_handler",
      "to": "aws_secretsmanager_secret.customer",
      "type": "reads_secret",
      "source": "lambda",
      "confidence": "high"
    }
  ]
}
